{
  "name": "Maze Rats: Monster & Animal Tables",
  "game": "maze-rats",
  "licence": "CC BY 4.0",
  "attribution": "Maze Rats, copyright Ben Milton (questingblog.com). Licensed under CC BY 4.0.",
  "usage_note": "36-entry tables are read as flat ordered lists using the source's 2d6 group-of-6 convention (see magic.json for full explanation). A uniform 1d36 pick produces an identical distribution.",
  "tables": [
    {
      "id": "aerial-animals",
      "name": "Aerial Animals",
      "roll": "2d6 (group of 6 / item in group)",
      "entries": [
        "Albatross",
        "Bat",
        "Beetle",
        "Bird of paradise",
        "Butterfly",
        "Condor",
        "Crane",
        "Crow",
        "Dragonfly",
        "Eagle",
        "Falcon",
        "Firefly",
        "Flamingo",
        "Fly",
        "Flying squirrel",
        "Goose",
        "Gull",
        "Hummingbird",
        "Kingfisher",
        "Locust",
        "Magpie",
        "Mantis",
        "Mockingbird",
        "Mosquito",
        "Moth",
        "Owl",
        "Parrot",
        "Peacock",
        "Pelican",
        "Pteranodon",
        "Rooster",
        "Sparrow",
        "Swan",
        "Vulture",
        "Wasp",
        "Woodpecker"
      ]
    },
    {
      "id": "terrestrial-animals",
      "name": "Terrestrial Animals",
      "roll": "2d6 (group of 6 / item in group)",
      "entries": [
        "Ant",
        "Ape",
        "Armadillo",
        "Badger",
        "Bear",
        "Boar",
        "Caterpillar",
        "Centipede",
        "Chameleon",
        "Cockroach",
        "Deer",
        "Elephant",
        "Ferret",
        "Fox",
        "Giraffe",
        "Goat",
        "Horse",
        "Human",
        "Mole",
        "Ostrich",
        "Ox",
        "Porcupine",
        "Rabbit",
        "Raccoon",
        "Rat",
        "Rhinoceros",
        "Scorpion",
        "Sheep",
        "Slug",
        "Snail",
        "Snake",
        "Spider",
        "Squirrel",
        "Tiger",
        "Wolf",
        "Wolverine"
      ]
    },
    {
      "id": "aquatic-animals",
      "name": "Aquatic Animals",
      "roll": "2d6 (group of 6 / item in group)",
      "entries": [
        "Alligator",
        "Amoeba",
        "Anglerfish",
        "Beaver",
        "Clam",
        "Crab",
        "Dolphin",
        "Eel",
        "Frog",
        "Hippopotamus",
        "Jellyfish",
        "Leech",
        "Lobster",
        "Manatee",
        "Manta ray",
        "Muskrat",
        "Narwhal",
        "Newt",
        "Octopus",
        "Otter",
        "Penguin",
        "Platypus",
        "Pufferfish",
        "Salamander",
        "Sea anemone",
        "Sea urchin",
        "Seahorse",
        "Seal",
        "Shark",
        "Shrimp",
        "Squid",
        "Swordfish",
        "Tadpole",
        "Turtle",
        "Walrus",
        "Whale"
      ]
    },
    {
      "id": "animal",
      "name": "Monster Base (animal category selector)",
      "roll": "1d6",
      "usage_note": "Source calls this table \"Monster Base\": roll once, or roll twice and combine the results. Rolls which animal sub-table (aerial/terrestrial/aquatic) to roll on.",
      "entries": [
        {
          "min": 1,
          "max": 2,
          "result": "aerial-animals"
        },
        {
          "min": 3,
          "max": 4,
          "result": "terrestrial-animals"
        },
        {
          "min": 5,
          "max": 6,
          "result": "aquatic-animals"
        }
      ]
    },
    {
      "id": "monster-features",
      "name": "Monster Features",
      "roll": "2d6 (group of 6 / item in group)",
      "entries": [
        "Antlers",
        "Beak",
        "Carapace",
        "Claws",
        "Compound eyes",
        "Eye stalks",
        "Fangs",
        "Fins",
        "Fur",
        "Gills",
        "Hooves",
        "Horns",
        "Legless",
        "Long tongue",
        "Many-eyed",
        "Many-limbed",
        "Mucus",
        "Pincers",
        "Plates",
        "Plumage",
        "Proboscis",
        "Scales",
        "Segments",
        "Shaggy hair",
        "Shell",
        "Spikes",
        "Spinnerets",
        "Spines",
        "Stinger",
        "Suction cups",
        "Tail",
        "Talons",
        "Tentacles",
        "Trunk",
        "Tusks",
        "Wings"
      ]
    },
    {
      "id": "monster-traits",
      "name": "Monster Traits",
      "roll": "2d6 (group of 6 / item in group)",
      "entries": [
        "Amphibious",
        "Bloated",
        "Brittle",
        "Cannibal",
        "Clay-like",
        "Colossal",
        "Crystalline",
        "Decaying",
        "Ethereal",
        "Ever-young",
        "Eyeless",
        "Fearless",
        "Fluffy",
        "Fungal",
        "Gelatinous",
        "Geometric",
        "Hardened",
        "Illusory",
        "Intelligent",
        "Iridescent",
        "Luminous",
        "Many-headed",
        "Mechanical",
        "Planar",
        "Reflective",
        "Rubbery",
        "Shadowy",
        "Sharp",
        "Skeletal",
        "Slimy",
        "Sticky",
        "Stinking",
        "Tiny",
        "Translucent",
        "{ethereal-elements}",
        "{physical-elements}"
      ]
    },
    {
      "id": "monster-abilities",
      "name": "Monster Abilities",
      "roll": "2d6 (group of 6 / item in group)",
      "entries": [
        "Absorbing",
        "Acid blood",
        "Anti-magic",
        "Blinding",
        "Breath weapon",
        "Camouflaging",
        "Duplicating",
        "Electric",
        "Entangling",
        "Exploding",
        "Flying",
        "Gaze weapon",
        "Hypnotizing",
        "Impervious",
        "Invisible",
        "Life-draining",
        "Magnetic",
        "Mimicking",
        "Mind-reading",
        "Paralyzing",
        "Phasing",
        "Poisonous",
        "Radioactive",
        "Reflective",
        "Regenerating",
        "Shapeshifting",
        "Spell-casting",
        "Stealthy",
        "Strangling",
        "Super-strength",
        "Telekinetic",
        "Teleporting",
        "Vampiric",
        "Wall-crawling",
        "{ethereal-effects}",
        "{physical-effects}"
      ]
    },
    {
      "id": "monster-tactics",
      "name": "Monster Tactics",
      "roll": "2d6 (group of 6 / item in group)",
      "entries": [
        "Ambush",
        "Call for support",
        "Capture",
        "Charge",
        "Climb foes",
        "Compel worship",
        "Create barrier",
        "Deceive",
        "Demand duel",
        "Disorient",
        "Encircle",
        "Evade",
        "Gang up",
        "Gather strength",
        "Go berserk",
        "Harry",
        "Hurl foes",
        "Immobilize",
        "Manipulate",
        "Mock",
        "Monologue",
        "Order minion",
        "Protect leader",
        "Protect self",
        "Scatter foes",
        "Stalk",
        "Steal from",
        "Swarm",
        "Target insolent",
        "Target leader",
        "Target nearest",
        "Target richest",
        "Target strongest",
        "Target weakest",
        "Toy with",
        "Use terrain"
      ]
    },
    {
      "id": "monster-personalities",
      "name": "Monster Personalities",
      "roll": "2d6 (group of 6 / item in group)",
      "usage_note": "Roll on this table or on the Personalities table from the Characters section.",
      "entries": [
        "Alien",
        "Aloof",
        "Bored",
        "Cautious",
        "Cowardly",
        "Curious",
        "Devious",
        "Distractible",
        "Educated",
        "Embittered",
        "Envious",
        "Erudite",
        "Fanatical",
        "Forgetful",
        "Generous",
        "Hateful",
        "Honorable",
        "Humble",
        "Jaded",
        "Jovial",
        "Legalistic",
        "Manipulative",
        "Megalomaniac",
        "Melancholy",
        "Meticulous",
        "Mystical",
        "Obsessive",
        "Out of touch",
        "Paranoid",
        "Polite",
        "Psychotic",
        "Sophisticated",
        "Touchy",
        "Unimpressed",
        "Vain",
        "Xenophobic"
      ]
    },
    {
      "id": "monster-weaknesses",
      "name": "Monster Weaknesses",
      "roll": "2d6 (group of 6 / item in group)",
      "entries": [
        "Bells",
        "Birdsong",
        "Children",
        "Cold",
        "Cold iron",
        "Competition",
        "Conversation",
        "Deformity",
        "Flattery",
        "Flowers",
        "Gifts",
        "Gold",
        "Heat",
        "Holy icon",
        "Holy water",
        "Home cooking",
        "{insanities}",
        "Mirrors",
        "Mistletoe",
        "Moonlight",
        "Music",
        "{methods}",
        "Phylactery",
        "{physical-elements}",
        "Puzzles",
        "Riddles",
        "Rituals",
        "Silver",
        "Sunlight",
        "Tears",
        "True name",
        "{valuable-materials}",
        "Weak spot",
        "{weapon-items}",
        "Wine",
        "Wormwood"
      ]
    }
  ]
}
