{
  "name": "Maze Rats: The Wild Tables",
  "game": "maze-rats",
  "licence": "CC BY 4.0",
  "attribution": "Maze Rats, copyright Ben Milton (questingblog.com). Licensed under CC BY 4.0.",
  "usage_note": "36-entry tables are read as flat ordered lists using the source's 2d6 group-of-6 convention (see magic.json for full explanation). A uniform 1d36 pick produces an identical distribution.",
  "tables": [
    {"id": "wilderness-regions", "name": "Wilderness Regions", "roll": "2d6 (group of 6 / item in group)", "entries": ["Ashy","Badlands","Bay","Beach","Delta","Desert","Dry lands","Dune sea","Dust bowl","Fjords","Flood lands","Foothills","Forest","Glaciers","Heath","Highlands","Hills","Ice fields","Jungle","Lowlands","Mesas","Moor","Mountains","Petrified forest","Plains","Rainforest","Riverlands","Salt pan","Savanna","Steppe","Taiga","Thickets","Tundra","Volcanic plain","Wetlands","Woodlands"]},
    {"id": "wilderness-landmarks", "name": "Wilderness Landmarks", "roll": "2d6 (group of 6 / item in group)", "entries": ["Bog","Boulder field","Butte","Cave","Cliff","Crag","Crater","Creek","Crossing","Ditch","Field","Forest","Grove","Hill","Hollow","Hot springs","Lair","Lake","Lakebed","Marsh","Mesa","Moor","Pass","Pit","Pond","Rapids","Ravine","Ridge","Rise","River","Rockslide","Spring","Swamp","Thickets","Valley","Waterfall"]},
    {"id": "wilderness-structures", "name": "Wilderness Structures", "roll": "2d6 (group of 6 / item in group)", "entries": ["Altar","Aqueduct","Bandit's camp","Battlefield","Bonfire","Bridge","Cairn","Crossroads","Crypt","Dam","Dungeon","Farm","Ford","Fortress","Gallows","Graveyard","Hedge","Hunter's camp","Inn","Lumber camp","Mine","Monastery","Monument","Orchard","Outpost","Pasture","Ruin","Seclusion","Shack","Shrine","Standing stone","Temple","Village","Wall","Watchtower","Waystone"]},
    {"id": "wilderness-region-traits", "name": "Wilderness Region Traits", "roll": "2d6 (group of 6 / item in group)", "entries": ["Ashen","Blasted","Blighted","Broken","Consuming","Corrupted","Creeping","Desolate","{dungeon-ruinations}","Eternal","{ethereal-effects}","Forsaken","Frozen","Haunted","Howling","Jagged","Lonely","Misty","Perilous","Petrified","Phantasmal","Ravenous","Savage","Shadowy","Shifting","Shivering","Sinister","Sinking","Smoldering","Sweltering","Thorny","Thundering","Torrential","{physical-effects}","Wandering","Withered"]},
    {"id": "wilderness-discoveries", "name": "Wilderness Discoveries", "roll": "2d6 (group of 6 / item in group)", "entries": ["Blood stains","Bones","Broken weapons","Burrow","{city-activities}","{civilized-npcs}","Cut ropes","Dead animal","{dungeon-activities}","Food scraps","Grave marker","Human corpse","{items}","Lost {npc-names}","Magical effect: {spells}","Map","Message","Migration","Mutation: {mutations}","Nest","Portal","Resources","Rift","Strange plant","Stunned {npc-names}","Supplies","Torn flag","Tracks","Trap","Treasure cache","{underworld-npcs}","{wilderness-activities}","{wilderness-landmarks}","{wilderness-structures}","{wilderness-npcs}","Wizard fight"]},
    {"id": "wilderness-activities", "name": "Wilderness Activities", "roll": "2d6 (group of 6 / item in group)", "entries": ["Ambush","Argue","Birth","Build","Bury","Capture","{city-activities}","Convene","Demolish","Die","Duel","{dungeon-activities}","Eat","Excavate","Feast","Felling","Fish","Flee","Forage","Hunt","March","Raid","Rescue","Rest","Sacrifice","Scout","Sing","Skin","Skirmish","Slay","Sleep","Swim","Track","Trap","Wander","Worship"]},
    {"id": "wilderness-hazards", "name": "Wilderness Hazards", "roll": "2d6 (group of 6 / item in group)", "entries": ["Avalanche","Blizzard","Brushfire","Cloudburst","Cyclone","Dense fog","Downpour","Drizzle","Dust storm","Earthquake","Eruption","Flooding","Forest fire","Hail","Heat wave","Hurricane","Ice storm","Light mist","Locust swarm","Magma flow","Meteor strike","Monsoon","Mudflow","Mudslide","Predator","Quicksand","Rain of frogs","Rockslide","Sandstorm","Sleet","Snow stampede","Thunderstorm","Tsunami","Whirlpool","Windstorm"], "count_note": "Source lists 35 entries."},
    {"id": "edible-plants", "name": "Edible Plants", "roll": "2d6 (group of 6 / item in group)", "entries": ["Acorns","Apples","Asparagus","Blackberries","Blueberries","Carrots","Cattail","Cherries","Chickweed","Chicory","Clover","Dandelion","Dead-nettle","Elderberries","Gooseberries","Hazelnuts","Henbit","Hickory nuts","Honeysuckle","Leeks","Milk thistle","Mint","Mulberries","Mushrooms","Mustard","Onion","Pecans","Persimmons","Raspberries","Strawberries","Walnuts","Watercress","Wild garlic","Wild grapes","Wood sorrel"], "count_note": "Source lists 35 entries."},
    {"id": "poisonous-plants", "name": "Poisonous Plants", "roll": "2d6 (group of 6 / item in group)", "entries": ["Angel's trumpet","Baneberry","Belladonna","Black truffle","Bleeding heart","Celandine","Cocklebur","Crowncup","Death cap","Dumbcane","Foxglove","Hemlock","Hogweed","Holly","Horse chestnut","Hyacinth","Ivy","Jessamine","Kudu","Larkspur","Mandrake","Mangrove","Mistletoe","Moonflower","Nightshade","Oleander","Ragwort","Reindeer lichen","Snakeweed","Spindle","Stinkhorn","Waxcap","Wine-cap","Wolfsbane","Wormwood"], "count_note": "Source lists 35 entries."}
  ]
}
